{
  "$schema": "./_schema.json",
  "id": "mystical_scroll",
  "display_name_key": "RELIC_MYSTICAL_SCROLL_NAME",
  "description_key": "RELIC_MYSTICAL_SCROLL_DESC",
  "rarity": "rare",
  "card_type": "relic",
  "hero_id": "",
  "skills": [
    { "skill_id": "mystical_scroll_discover" },
    { "skill_id": "mystical_scroll_summon" }
  ],
  "sprite_sheet": "",
  "animations": {},
  "tags": ["beast"]
}
