{
  "$schema": "./_schema.json",
  "id": "vine_basket",
  "display_name_key": "RELIC_VINE_BASKET_NAME",
  "description_key": "RELIC_VINE_BASKET_DESC",
  "rarity": "rare",
  "card_type": "relic",
  "hero_id": "",
  "skills": [
    { "skill_id": "vine_basket_bonus_play" },
    { "skill_id": "vine_basket_reset" }
  ],
  "sprite_sheet": "",
  "animations": {},
  "tags": ["deck"]
}
